{
  "$id": "lena_video_camera_v1.schema.json", "$schema": "https://json-schema.org/draft/2020-12/schema", "type": "object", "additionalProperties": false,
  "required": ["schema_version", "artifact_type", "artifact_id", "property_id", "video_id", "governed_date", "created_at", "generator_version", "upstream_artifacts", "camera_holder", "device_type", "camera_position", "framing", "safe_headroom_basis_points", "lens_behavior", "camera_movement", "autofocus", "exposure", "subject_scale", "background_scale", "caption_safe_areas", "lena_camera_relationship", "selfie", "provider_neutral_requirements", "provider_prompt_cue"],
  "properties": {
    "schema_version": {"const": "lena_video_artifact_v1"}, "artifact_type": {"const": "lena_video_camera_v1"}, "artifact_id": {"$ref": "common_defs_v1.schema.json#/$defs/artifact_id"}, "property_id": {"const": "lena"}, "video_id": {"$ref": "common_defs_v1.schema.json#/$defs/video_id"}, "governed_date": {"$ref": "common_defs_v1.schema.json#/$defs/governed_date"}, "created_at": {"$ref": "common_defs_v1.schema.json#/$defs/created_at"}, "generator_version": {"$ref": "common_defs_v1.schema.json#/$defs/slug"}, "upstream_artifacts": {"$ref": "common_defs_v1.schema.json#/$defs/upstream_artifacts"},
    "camera_holder": {"const": "another_person"}, "device_type": {"enum": ["smartphone_rear_camera", "smartphone_main_camera"]}, "camera_position": {"$ref": "common_defs_v1.schema.json#/$defs/nonempty_string"}, "framing": {"$ref": "common_defs_v1.schema.json#/$defs/nonempty_string"}, "safe_headroom_basis_points": {"type": "integer", "minimum": 1000, "maximum": 2500}, "lens_behavior": {"$ref": "common_defs_v1.schema.json#/$defs/nonempty_string"}, "camera_movement": {"enum": ["steady_handheld_micro_reframe", "locked_handheld"]}, "autofocus": {"$ref": "common_defs_v1.schema.json#/$defs/nonempty_string"}, "exposure": {"$ref": "common_defs_v1.schema.json#/$defs/nonempty_string"}, "subject_scale": {"$ref": "common_defs_v1.schema.json#/$defs/nonempty_string"}, "background_scale": {"$ref": "common_defs_v1.schema.json#/$defs/nonempty_string"}, "caption_safe_areas": {"$ref": "common_defs_v1.schema.json#/$defs/string_list"}, "lena_camera_relationship": {"$ref": "common_defs_v1.schema.json#/$defs/nonempty_string"}, "selfie": {"const": false}, "provider_neutral_requirements": {"$ref": "common_defs_v1.schema.json#/$defs/string_list"}, "provider_prompt_cue": {"$ref": "common_defs_v1.schema.json#/$defs/provider_prompt_cue"}
  }
}
